{
  "$schema": "https://json-schema.org/draft/2020-12/schema",
  "title": "INTERP-DIALOGUE-001P0-v1 elicitation instrument",
  "type": "object",
  "additionalProperties": false,
  "required": [
    "$schema",
    "schema_version",
    "study_id",
    "instrument_id",
    "instrument_version",
    "status",
    "authority",
    "base_contract_binding",
    "base_contract_composition",
    "semantic_source_bindings",
    "revision_authority_bindings",
    "participant_surface_binding",
    "rendered_surface_catalog_binding",
    "mapping_schema_bindings",
    "renderer_contract",
    "event_schedule",
    "presentations",
    "future_options",
    "family_prompt_deliveries",
    "diagnostic_delivery_surface_id",
    "mapping_lineage_contract",
    "confirmed_defect_refs_pending_repilot",
    "open_deferred_defect_refs",
    "rejected_defect_receipt_refs",
    "defect_resolution_claims",
    "prohibitions"
  ],
  "properties": {
    "$schema": {
      "const": "./instrument-v1.schema.json"
    },
    "schema_version": {
      "const": "1.0.0"
    },
    "study_id": {
      "const": "INTERP-DIALOGUE-001P0"
    },
    "instrument_id": {
      "const": "INTERP-DIALOGUE-001P0-ELICITATION-INSTRUMENT-V1"
    },
    "instrument_version": {
      "const": "1.0.0"
    },
    "status": {
      "const": "FROZEN_UNEXECUTED_DEVELOPMENT_ELICITATION_ONLY"
    },
    "authority": {
      "$ref": "#/$defs/nonEmptyString"
    },
    "base_contract_binding": {
      "$ref": "#/$defs/binding"
    },
    "base_contract_composition": {
      "$ref": "#/$defs/baseContractComposition"
    },
    "semantic_source_bindings": {
      "type": "array",
      "minItems": 4,
      "maxItems": 4,
      "items": {
        "$ref": "#/$defs/binding"
      }
    },
    "revision_authority_bindings": {
      "type": "array",
      "minItems": 3,
      "maxItems": 3,
      "items": {
        "$ref": "#/$defs/binding"
      }
    },
    "participant_surface_binding": {
      "$ref": "#/$defs/binding"
    },
    "rendered_surface_catalog_binding": {
      "$ref": "#/$defs/binding"
    },
    "mapping_schema_bindings": {
      "type": "array",
      "minItems": 2,
      "maxItems": 2,
      "items": {
        "$ref": "#/$defs/binding"
      }
    },
    "renderer_contract": {
      "$ref": "#/$defs/rendererContract"
    },
    "event_schedule": {
      "type": "array",
      "minItems": 8,
      "maxItems": 8,
      "items": {
        "$ref": "#/$defs/scheduleStep"
      }
    },
    "presentations": {
      "type": "array",
      "minItems": 24,
      "maxItems": 24,
      "items": {
        "$ref": "#/$defs/presentation"
      }
    },
    "future_options": {
      "type": "array",
      "minItems": 6,
      "maxItems": 6,
      "items": {
        "$ref": "#/$defs/futureOption"
      }
    },
    "family_prompt_deliveries": {
      "type": "array",
      "minItems": 3,
      "maxItems": 3,
      "items": {
        "$ref": "#/$defs/familyPrompts"
      }
    },
    "diagnostic_delivery_surface_id": {
      "$ref": "#/$defs/token"
    },
    "mapping_lineage_contract": {
      "$ref": "#/$defs/mappingContract"
    },
    "confirmed_defect_refs_pending_repilot": {
      "type": "array",
      "minItems": 9,
      "maxItems": 9,
      "items": {
        "$ref": "#/$defs/token"
      }
    },
    "open_deferred_defect_refs": {
      "type": "array",
      "minItems": 4,
      "maxItems": 4,
      "items": {
        "$ref": "#/$defs/token"
      }
    },
    "rejected_defect_receipt_refs": {
      "type": "array",
      "minItems": 1,
      "maxItems": 1,
      "items": {
        "$ref": "#/$defs/token"
      }
    },
    "defect_resolution_claims": {
      "type": "array",
      "maxItems": 0,
      "items": {
        "type": "string"
      }
    },
    "prohibitions": {
      "type": "array",
      "minItems": 10,
      "items": {
        "$ref": "#/$defs/nonEmptyString"
      }
    }
  },
  "$defs": {
    "nonEmptyString": {
      "type": "string",
      "minLength": 1
    },
    "token": {
      "type": "string",
      "pattern": "^[A-Za-z0-9][A-Za-z0-9._:-]*$"
    },
    "sha256": {
      "type": "string",
      "pattern": "^[0-9a-f]{64}$"
    },
    "stringArray": {
      "type": "array",
      "items": {
        "type": "string"
      }
    },
    "binding": {
      "type": "object",
      "additionalProperties": false,
      "required": [
        "artifact_id",
        "path",
        "content_sha256"
      ],
      "properties": {
        "artifact_id": {
          "$ref": "#/$defs/nonEmptyString"
        },
        "path": {
          "$ref": "#/$defs/nonEmptyString"
        },
        "content_sha256": {
          "$ref": "#/$defs/sha256"
        }
      }
    },
    "rendererContract": {
      "type": "object",
      "additionalProperties": false,
      "required": [
        "semantics_version",
        "participant_visible_output_authority",
        "fallback_policy",
        "semantic_source_direct_text_read",
        "catalog_membership_policy"
      ],
      "properties": {
        "semantics_version": {
          "const": "INTERP-DIALOGUE-P0-V1-RENDERER-1.0.0"
        },
        "participant_visible_output_authority": {
          "const": "RENDERED_SURFACE_CATALOG_ONLY"
        },
        "fallback_policy": {
          "const": "FORBIDDEN"
        },
        "semantic_source_direct_text_read": {
          "const": "FORBIDDEN"
        },
        "catalog_membership_policy": {
          "const": "UNREGISTERED_OUTPUT_FORBIDDEN"
        }
      }
    },
    "baseContractComposition": {
      "type": "object",
      "additionalProperties": false,
      "required": [
        "inherited_sections",
        "replaced_sections",
        "participant_text_inheritance"
      ],
      "properties": {
        "inherited_sections": {
          "type": "array",
          "minItems": 6,
          "items": {
            "$ref": "#/$defs/token"
          }
        },
        "replaced_sections": {
          "type": "array",
          "minItems": 8,
          "items": {
            "$ref": "#/$defs/token"
          }
        },
        "participant_text_inheritance": {
          "const": "FORBIDDEN"
        }
      }
    },
    "scheduleStep": {
      "type": "object",
      "additionalProperties": false,
      "required": [
        "step_id",
        "sequence_ordinal",
        "event_kind",
        "required",
        "payload_source"
      ],
      "properties": {
        "step_id": {
          "$ref": "#/$defs/token"
        },
        "sequence_ordinal": {
          "type": "integer",
          "minimum": 0
        },
        "event_kind": {
          "$ref": "#/$defs/token"
        },
        "required": {
          "type": "boolean"
        },
        "payload_source": {
          "$ref": "#/$defs/token"
        }
      }
    },
    "presentation": {
      "type": "object",
      "additionalProperties": false,
      "required": [
        "presentation_id",
        "family_id",
        "source_cell_id",
        "delivery_surface_id"
      ],
      "properties": {
        "presentation_id": {
          "$ref": "#/$defs/token"
        },
        "family_id": {
          "$ref": "#/$defs/token"
        },
        "source_cell_id": {
          "$ref": "#/$defs/token"
        },
        "delivery_surface_id": {
          "$ref": "#/$defs/token"
        }
      }
    },
    "futureOption": {
      "type": "object",
      "additionalProperties": false,
      "required": [
        "future_option_id",
        "family_id",
        "source_probe_id",
        "source_option_index",
        "delivery_surface_id"
      ],
      "properties": {
        "future_option_id": {
          "$ref": "#/$defs/token"
        },
        "family_id": {
          "$ref": "#/$defs/token"
        },
        "source_probe_id": {
          "$ref": "#/$defs/token"
        },
        "source_option_index": {
          "type": "integer",
          "minimum": 0
        },
        "delivery_surface_id": {
          "$ref": "#/$defs/token"
        }
      }
    },
    "familyPrompts": {
      "type": "object",
      "additionalProperties": false,
      "required": [
        "family_id",
        "immediate_delivery_surface_id",
        "later_delivery_surface_id"
      ],
      "properties": {
        "family_id": {
          "$ref": "#/$defs/token"
        },
        "immediate_delivery_surface_id": {
          "$ref": "#/$defs/token"
        },
        "later_delivery_surface_id": {
          "$ref": "#/$defs/token"
        }
      }
    },
    "mappingContract": {
      "type": "object",
      "additionalProperties": false,
      "required": [
        "attempt_cardinality",
        "attempt_dispositions",
        "candidate_statuses",
        "applied_candidate_set_cardinality",
        "non_applied_candidate_set_cardinality",
        "ambiguous_alternative_cardinality",
        "response_disposition_is_not_evaluability"
      ],
      "properties": {
        "attempt_cardinality": {
          "const": "EXACTLY_ONE_PER_ELIGIBLE_R1_R2_EVENT"
        },
        "attempt_dispositions": {
          "type": "array",
          "minItems": 3,
          "maxItems": 3,
          "items": {
            "$ref": "#/$defs/token"
          }
        },
        "candidate_statuses": {
          "type": "array",
          "minItems": 4,
          "maxItems": 4,
          "items": {
            "$ref": "#/$defs/token"
          }
        },
        "applied_candidate_set_cardinality": {
          "const": "EXACTLY_ONE"
        },
        "non_applied_candidate_set_cardinality": {
          "const": "ZERO"
        },
        "ambiguous_alternative_cardinality": {
          "const": "AT_LEAST_TWO"
        },
        "response_disposition_is_not_evaluability": {
          "const": true
        }
      }
    }
  }
}
