{
  "$schema": "./instrument-v1.schema.json",
  "schema_version": "1.0.0",
  "study_id": "INTERP-DIALOGUE-001P0",
  "instrument_id": "INTERP-DIALOGUE-001P0-ELICITATION-INSTRUMENT-V1",
  "instrument_version": "1.0.0",
  "status": "FROZEN_UNEXECUTED_DEVELOPMENT_ELICITATION_ONLY",
  "authority": "DEVELOPMENT_ELICITATION_CONTRACT_NO_ACQUISITION_MEASUREMENT_OR_CLAIM_SUPPORT",
  "base_contract_binding": {
    "artifact_id": "INTERP-DIALOGUE-001P0-ELICITATION-INSTRUMENT-V0",
    "path": "research/scenarios/interp-dialogue-001/elicitation/instrument-v0.json",
    "content_sha256": "52705bc686a69d43360eb0544eda59571c77dc1e29520ec4b156bcd60f413776"
  },
  "base_contract_composition": {
    "inherited_sections": [
      "response_status_vocabulary",
      "development_source_kinds",
      "matched_future_comparisons",
      "response_provenance_contract",
      "processing_role_contract",
      "defect_taxonomy"
    ],
    "replaced_sections": [
      "language_policy",
      "rendering_policy",
      "prompt_catalog",
      "event_schedule",
      "presentations",
      "future_option_catalog",
      "mapping_boundary",
      "revision_proposal_contract",
      "prohibitions"
    ],
    "participant_text_inheritance": "FORBIDDEN"
  },
  "semantic_source_bindings": [
    {
      "artifact_id": "REL-BOUNDARY-001",
      "path": "research/scenarios/interp-dialogue-001/families/rel-boundary.json",
      "content_sha256": "4eb342e655ded940ab8537f4e7827692829967a35f17feb375e731a24d2750e2"
    },
    {
      "artifact_id": "WORK-FEEDBACK-001",
      "path": "research/scenarios/interp-dialogue-001/families/work-feedback.json",
      "content_sha256": "71cedb46667d1fc2ab76ee1e9711e8f0344e3fea6cf9bd16b577643d292d5823"
    },
    {
      "artifact_id": "RISK-FOOTSTEPS-001",
      "path": "research/scenarios/interp-dialogue-001/families/risk-footsteps.json",
      "content_sha256": "4fbe69cbe8bd8edb631c9012810dbf935b69f10d5afa7c670638177eabb2a256"
    },
    {
      "artifact_id": "INTERP-DIALOGUE-001B-TRACE-ORACLE-V1",
      "path": "research/scenarios/interp-dialogue-001/trace-oracle-v1.json",
      "content_sha256": "9caefdf39b9ac41c355f8afed0f4c5d0f780499f571346ef2a7042fa30da74b9"
    }
  ],
  "revision_authority_bindings": [
    {
      "artifact_id": "INTERP-DIALOGUE-001P0-V1-RESOLUTION-CANDIDATES",
      "path": "research/scenarios/interp-dialogue-001/elicitation/p0-v1/revision-resolution-candidates-v1.json",
      "content_sha256": "8e94d0ae86055df8ec37e57d300720e607c966ec03f32b4c839d2efc6618dc0d"
    },
    {
      "artifact_id": "INTERP-DIALOGUE-001P0-V1-DECISION-RECEIPTS",
      "path": "research/scenarios/interp-dialogue-001/elicitation/p0-v1/p0-decision-receipts-v1.json",
      "content_sha256": "b0ad767f1611651aa9267de275cc00a08271a24f3290019d6f3a4c07d27c81cc"
    },
    {
      "artifact_id": "INTERP-DIALOGUE-001P0-V1-PROPOSAL-DISPOSITIONS",
      "path": "research/scenarios/interp-dialogue-001/elicitation/p0-v1/proposal-disposition-record-v1.json",
      "content_sha256": "eb7004fcbdb958f87f18a6f00a2c31aea5181a9a9284882f40a18e621768450a"
    }
  ],
  "participant_surface_binding": {
    "artifact_id": "PARTICIPANT-SURFACE-V1",
    "path": "research/scenarios/interp-dialogue-001/elicitation/p0-v1/participant-surface-v1.json",
    "content_sha256": "4162390948b5d346d4accbdd42286d66bc32c99174a169b3307a1b05b9d5587f"
  },
  "rendered_surface_catalog_binding": {
    "artifact_id": "INTERP-DIALOGUE-001P0-V1-RENDERED-SURFACES",
    "path": "research/scenarios/interp-dialogue-001/elicitation/p0-v1/rendered-surface-catalog-v1.json",
    "content_sha256": "29d336f7c030ceb1a878031a64b0852de56d2b00e42067590c4e05ddf82bc7ba"
  },
  "mapping_schema_bindings": [
    {
      "artifact_id": "DEVELOPMENT-MAPPING-CANDIDATE-SCHEMA-V1",
      "path": "research/scenarios/interp-dialogue-001/elicitation/p0-v1/development-assessment-v1.schema.json",
      "content_sha256": "8880733a82a659f21d5b82ca2989ce57617ae5e21beb22f285b7692b6e639f09"
    },
    {
      "artifact_id": "MAPPING-ATTEMPT-LINEAGE-SCHEMA-V1",
      "path": "research/scenarios/interp-dialogue-001/elicitation/p0-v1/mapping-attempt-v1.schema.json",
      "content_sha256": "54b917365e92c59179d4339fb7fcc56d6506f339cb895c090575d06c4d4552c8"
    }
  ],
  "renderer_contract": {
    "semantics_version": "INTERP-DIALOGUE-P0-V1-RENDERER-1.0.0",
    "participant_visible_output_authority": "RENDERED_SURFACE_CATALOG_ONLY",
    "fallback_policy": "FORBIDDEN",
    "semantic_source_direct_text_read": "FORBIDDEN",
    "catalog_membership_policy": "UNREGISTERED_OUTPUT_FORBIDDEN"
  },
  "event_schedule": [
    {
      "step_id": "E0_INITIAL_VIGNETTE_DELIVERY",
      "sequence_ordinal": 0,
      "event_kind": "STIMULUS_DELIVERY",
      "required": true,
      "payload_source": "REGISTERED_INITIAL_DELIVERY_SURFACE"
    },
    {
      "step_id": "E1_GENERIC_IMMEDIATE_RESPONSE_PROMPT_DELIVERY",
      "sequence_ordinal": 1,
      "event_kind": "PROMPT_DELIVERY",
      "required": true,
      "payload_source": "FAMILY_RESOLVED_IMMEDIATE_PROMPT_SURFACE"
    },
    {
      "step_id": "R1_IMMEDIATE_RESPONSE_EVENT",
      "sequence_ordinal": 2,
      "event_kind": "SCRIPTED_RESPONSE_RECORD",
      "required": true,
      "payload_source": "SESSION_IMMEDIATE_RESPONSE"
    },
    {
      "step_id": "E2_MATCHED_FUTURE_OPTION_DELIVERY",
      "sequence_ordinal": 3,
      "event_kind": "STIMULUS_DELIVERY",
      "required": true,
      "payload_source": "REGISTERED_FUTURE_DELIVERY_SURFACE"
    },
    {
      "step_id": "E3_GENERIC_LATER_RESPONSE_PROMPT_DELIVERY",
      "sequence_ordinal": 4,
      "event_kind": "PROMPT_DELIVERY",
      "required": true,
      "payload_source": "FAMILY_RESOLVED_LATER_PROMPT_SURFACE"
    },
    {
      "step_id": "R2_LATER_RESPONSE_EVENT",
      "sequence_ordinal": 5,
      "event_kind": "SCRIPTED_RESPONSE_RECORD",
      "required": true,
      "payload_source": "SESSION_LATER_RESPONSE"
    },
    {
      "step_id": "D0_POST_TRACE_DIAGNOSTIC_PROMPT_DELIVERY",
      "sequence_ordinal": 6,
      "event_kind": "PROMPT_DELIVERY",
      "required": false,
      "payload_source": "REGISTERED_DIAGNOSTIC_DELIVERY_SURFACE"
    },
    {
      "step_id": "RD0_RETROSPECTIVE_DIAGNOSTIC_RESPONSE_EVENT",
      "sequence_ordinal": 7,
      "event_kind": "SCRIPTED_RESPONSE_RECORD",
      "required": false,
      "payload_source": "SESSION_POST_TRACE_DIAGNOSTIC_RESPONSE"
    }
  ],
  "presentations": [
    {
      "presentation_id": "PRES-REL-000-EN-V1",
      "family_id": "REL-BOUNDARY-001",
      "source_cell_id": "rel-000",
      "delivery_surface_id": "DELIVERY-PRES-REL-000-EN-V1"
    },
    {
      "presentation_id": "PRES-REL-001-EN-V1",
      "family_id": "REL-BOUNDARY-001",
      "source_cell_id": "rel-001",
      "delivery_surface_id": "DELIVERY-PRES-REL-001-EN-V1"
    },
    {
      "presentation_id": "PRES-REL-010-EN-V1",
      "family_id": "REL-BOUNDARY-001",
      "source_cell_id": "rel-010",
      "delivery_surface_id": "DELIVERY-PRES-REL-010-EN-V1"
    },
    {
      "presentation_id": "PRES-REL-011-EN-V1",
      "family_id": "REL-BOUNDARY-001",
      "source_cell_id": "rel-011",
      "delivery_surface_id": "DELIVERY-PRES-REL-011-EN-V1"
    },
    {
      "presentation_id": "PRES-REL-100-EN-V1",
      "family_id": "REL-BOUNDARY-001",
      "source_cell_id": "rel-100",
      "delivery_surface_id": "DELIVERY-PRES-REL-100-EN-V1"
    },
    {
      "presentation_id": "PRES-REL-101-EN-V1",
      "family_id": "REL-BOUNDARY-001",
      "source_cell_id": "rel-101",
      "delivery_surface_id": "DELIVERY-PRES-REL-101-EN-V1"
    },
    {
      "presentation_id": "PRES-REL-110-EN-V1",
      "family_id": "REL-BOUNDARY-001",
      "source_cell_id": "rel-110",
      "delivery_surface_id": "DELIVERY-PRES-REL-110-EN-V1"
    },
    {
      "presentation_id": "PRES-REL-111-EN-V1",
      "family_id": "REL-BOUNDARY-001",
      "source_cell_id": "rel-111",
      "delivery_surface_id": "DELIVERY-PRES-REL-111-EN-V1"
    },
    {
      "presentation_id": "PRES-WORK-000-EN-V1",
      "family_id": "WORK-FEEDBACK-001",
      "source_cell_id": "work-000",
      "delivery_surface_id": "DELIVERY-PRES-WORK-000-EN-V1"
    },
    {
      "presentation_id": "PRES-WORK-001-EN-V1",
      "family_id": "WORK-FEEDBACK-001",
      "source_cell_id": "work-001",
      "delivery_surface_id": "DELIVERY-PRES-WORK-001-EN-V1"
    },
    {
      "presentation_id": "PRES-WORK-010-EN-V1",
      "family_id": "WORK-FEEDBACK-001",
      "source_cell_id": "work-010",
      "delivery_surface_id": "DELIVERY-PRES-WORK-010-EN-V1"
    },
    {
      "presentation_id": "PRES-WORK-011-EN-V1",
      "family_id": "WORK-FEEDBACK-001",
      "source_cell_id": "work-011",
      "delivery_surface_id": "DELIVERY-PRES-WORK-011-EN-V1"
    },
    {
      "presentation_id": "PRES-WORK-100-EN-V1",
      "family_id": "WORK-FEEDBACK-001",
      "source_cell_id": "work-100",
      "delivery_surface_id": "DELIVERY-PRES-WORK-100-EN-V1"
    },
    {
      "presentation_id": "PRES-WORK-101-EN-V1",
      "family_id": "WORK-FEEDBACK-001",
      "source_cell_id": "work-101",
      "delivery_surface_id": "DELIVERY-PRES-WORK-101-EN-V1"
    },
    {
      "presentation_id": "PRES-WORK-110-EN-V1",
      "family_id": "WORK-FEEDBACK-001",
      "source_cell_id": "work-110",
      "delivery_surface_id": "DELIVERY-PRES-WORK-110-EN-V1"
    },
    {
      "presentation_id": "PRES-WORK-111-EN-V1",
      "family_id": "WORK-FEEDBACK-001",
      "source_cell_id": "work-111",
      "delivery_surface_id": "DELIVERY-PRES-WORK-111-EN-V1"
    },
    {
      "presentation_id": "PRES-RISK-000-EN-V1",
      "family_id": "RISK-FOOTSTEPS-001",
      "source_cell_id": "risk-000",
      "delivery_surface_id": "DELIVERY-PRES-RISK-000-EN-V1"
    },
    {
      "presentation_id": "PRES-RISK-001-EN-V1",
      "family_id": "RISK-FOOTSTEPS-001",
      "source_cell_id": "risk-001",
      "delivery_surface_id": "DELIVERY-PRES-RISK-001-EN-V1"
    },
    {